name,region,country,founded,status,website,description
Glenfarclas,Speyside,Scotland,1836,active,https://www.glenfarclas.com,Family-owned distillery known for sherry cask whiskies
Caol Ila,Islay,Scotland,1846,active,https://www.caolila.com,Light and smoky Islay single malt
Clynelish,Highland,Scotland,1967,active,,Highland distillery with waxy honeyed character
Ben Nevis,Highland,Scotland,1825,active,https://www.bennevisdistillery.com,Highland distillery at the foot of Ben Nevis mountain
Kilchoman,Islay,Scotland,2005,active,https://kilchomandistillery.com,Young Islay distillery with traditional methods